{
  "$schema": "http://json-schema.org/draft-07/schema#",
  "title": "Carbon Rewind Palette",
  "type": "object",
  "required": ["id", "label", "scaffold", "roles"],
  "properties": {
    "id": { "type": "string", "pattern": "^[a-z0-9-]+$" },
    "label": { "type": "string" },
    "scaffold": { "enum": ["maya", "base", "pure", "winter"] },
    "extends": { "type": "string" },
    "publish": { "type": "boolean", "default": true },
    "roles": {
      "type": "object",
      "additionalProperties": {
        "type": "string",
        "pattern": "^#[0-9a-fA-F]{3,8}$"
      }
    },
    "replacements": {
      "type": "object",
      "additionalProperties": { "type": "string" }
    }
  },
  "additionalProperties": false
}
