{
  "id": "maya-black",
  "label": "Carbon Rewind Color Theme - Maya Black",
  "scaffold": "maya",
  "roles": {
    "c_000000": "#000000",
    "c_000205": "#000205",
    "c_06090d": "#06090d",
    "c_11151c": "#11151c",
    "c_131721": "#111620",
    "c_39bae6": "#39bae6",
    "c_409fff": "#409fff",
    "c_475266": "#475266",
    "c_53bdfa": "#53bdfa",
    "c_565b66": "#565b66",
    "c_59c2ff": "#59c2ff",
    "c_5f4c72": "#5f4c72",
    "c_686868": "#686868",
    "c_6c5980": "#6c5980",
    "c_6c7380": "#6c7380",
    "c_73b8ff": "#73b8ff",
    "c_7fd962": "#7fd962",
    "c_90e1c6": "#90e1c6",
    "c_95e6cb": "#95e6cb",
    "c_a28bc0": "#a28bc0",
    "c_aad94c": "#aad94c",
    "c_acb6bf": "#9aa3ac",
    "c_bfbdb6": "#bfbdb6",
    "c_c594c5": "#c594c5",
    "c_c7c7c7": "#c7c7c7",
    "c_cda1fa": "#cda1fa",
    "c_d2a6ff": "#d2a6ff",
    "c_d95757": "#d95757",
    "c_e06c75": "#e06c75",
    "c_e1af4b": "#e1af4b",
    "c_e6b450": "#e6b450",
    "c_e6b673": "#e6b673",
    "c_ea6c73": "#ea6c73",
    "c_f07178": "#f07178",
    "c_f26d78": "#f26d78",
    "c_f29668": "#f29668",
    "c_f7ecb5": "#f7ecb5",
    "c_f9af4f": "#f9af4f",
    "c_ff8f40": "#ff8f40",
    "c_ffb454": "#ffb454",
    "c_ffffff": "#ffffff",
    "c_0b0e14": "#010308"
  }
}
