{
  "id": "color",
  "label": "Carbon Rewind Color Theme",
  "scaffold": "base",
  "roles": {
    "c_000000": "#000000",
    "c_001111": "#001111",
    "c_00809b": "#00809b",
    "c_010b14": "#010b14",
    "c_011627": "#011627",
    "c_020202": "#020202",
    "c_022846": "#022846",
    "c_03648a": "#03648a",
    "c_06202c": "#06202c",
    "c_072243": "#072243",
    "c_0b0e12": "#0b0e12",
    "c_0d1014": "#0d1014",
    "c_0f1318": "#0f1318",
    "c_10161c": "#10161c",
    "c_103362": "#103362",
    "c_121212": "#121212",
    "c_151d25": "#151d25",
    "c_181a1f": "#181a1f",
    "c_1d1f23": "#1d1f23",
    "c_202020": "#202020",
    "c_20282d": "#20282d",
    "c_212025": "#212025",
    "c_219fd5": "#219fd5",
    "c_262a39": "#262a39",
    "c_2c313a": "#2c313a",
    "c_2e3250": "#2e3250",
    "c_303030": "#303030",
    "c_314365": "#314365",
    "c_383e4a": "#383e4a",
    "c_3b4048": "#3b4048",
    "c_3e4451": "#3e4451",
    "c_407040": "#407040",
    "c_4373c2": "#4373c2",
    "c_484848": "#484848",
    "c_484a50": "#484a50",
    "c_495162": "#495162",
    "c_4c0769": "#4c0769",
    "c_4e5666": "#4e5666",
    "c_4ed6d6": "#4ed6d6",
    "c_528bff": "#528bff",
    "c_56b6c2": "#56b6c2",
    "c_5a6375": "#5a6375",
    "c_5abeb0": "#5abeb0",
    "c_5c6370": "#5c6370",
    "c_5f7e97": "#5f7e97",
    "c_61afef": "#61afef",
    "c_6796e6": "#6796e6",
    "c_696969": "#696969",
    "c_697098": "#697098",
    "c_6b717d": "#6b717d",
    "c_704040": "#704040",
    "c_707040": "#707040",
    "c_747d91": "#747d91",
    "c_75715e": "#75715e",
    "c_7799bb": "#7799bb",
    "c_7e57c2": "#7e57c2",
    "c_80cbc4": "#80cbc4",
    "c_8282c7": "#8282c7",
    "c_975f94": "#975f94",
    "c_98c379": "#98c379",
    "c_98c8ed": "#98c8ed",
    "c_9da5b4": "#9da5b4",
    "c_abb2bf": "#abb2bf",
    "c_addb67": "#addb67",
    "c_b267e6": "#b267e6",
    "c_b6a0a0": "#b6a0a0",
    "c_bbbbbb": "#bbbbbb",
    "c_c5c5c5": "#c5c5c5",
    "c_c678dd": "#c678dd",
    "c_c792ea": "#c792ea",
    "c_cd9731": "#cd9731",
    "c_cecece": "#cecece",
    "c_d19a66": "#d19a66",
    "c_d2dee7": "#d2dee7",
    "c_d6deeb": "#d6deeb",
    "c_d7dae0": "#d7dae0",
    "c_e06c75": "#e06c75",
    "c_e5c07b": "#e5c07b",
    "c_ef5350": "#ef5350",
    "c_f44747": "#f44747",
    "c_f7ecb5": "#f7ecb5",
    "c_f8f8f0": "#f8f8f0",
    "c_ffffff": "#ffffff"
  }
}
