{
  "id": "dusk",
  "label": "Carbon Rewind Color Theme - Dusk",
  "scaffold": "maya",
  "roles": {
    "c_000000": "#000000",
    "c_0b0e14": "#0e0a14",
    "c_0d1017": "#120d18",
    "c_0f131a": "#110c17",
    "c_11151c": "#1a1424",
    "c_131721": "#15101e",
    "c_39bae6": "#c4a8ff",
    "c_409fff": "#9d7cff4d",
    "c_475266": "#4a3a60",
    "c_53bdfa": "#9d7cff",
    "c_565b66": "#6a6080",
    "c_59c2ff": "#a78bfa",
    "c_5f4c72": "#5a4080",
    "c_686868": "#686868",
    "c_6c5980": "#6b5090",
    "c_6c7380": "#7a7090",
    "c_73b8ff": "#9d7cff",
    "c_7fd962": "#b794f6",
    "c_90e1c6": "#d8b4fe",
    "c_95e6cb": "#d8b4fe",
    "c_a28bc0": "#d8b4fe",
    "c_aad94c": "#c4a8ff",
    "c_acb6bf": "#7a7090",
    "c_bfbdb6": "#bfbdb6",
    "c_c594c5": "#c4a8ff",
    "c_c7c7c7": "#c7c7c7",
    "c_cda1fa": "#d8b4fe",
    "c_d2a6ff": "#ffb4e6",
    "c_d95757": "#d95757",
    "c_e06c75": "#e2b0ff",
    "c_e1af4b": "#8f6ef0",
    "c_e6b450": "#9d7cff",
    "c_e6b673": "#d8b4fe",
    "c_ea6c73": "#ea6c73",
    "c_f07178": "#ffb4e6",
    "c_f26d78": "#f26d78",
    "c_f29668": "#c4a8ff",
    "c_f7ecb5": "#e9d5ff",
    "c_f9af4f": "#e2b0ff",
    "c_ff8f40": "#b794f6",
    "c_ffb454": "#e2b0ff",
    "c_ffffff": "#ffffff"
  }
}
