{
  "id": "moss",
  "label": "Carbon Rewind Color Theme - Moss",
  "scaffold": "maya",
  "roles": {
    "c_000000": "#000000",
    "c_0b0e14": "#0a0f0c",
    "c_0d1017": "#0e1511",
    "c_0f131a": "#0c1210",
    "c_11151c": "#152018",
    "c_131721": "#101812",
    "c_39bae6": "#7ec699",
    "c_409fff": "#5dbd734d",
    "c_475266": "#3a5540",
    "c_53bdfa": "#5dbd73",
    "c_565b66": "#5a7560",
    "c_59c2ff": "#6dbf8a",
    "c_5f4c72": "#3a5540",
    "c_686868": "#686868",
    "c_6c5980": "#4a6850",
    "c_6c7380": "#6b8f71",
    "c_73b8ff": "#5dbd73",
    "c_7fd962": "#7fd962",
    "c_90e1c6": "#9ad4a8",
    "c_95e6cb": "#9ad4a8",
    "c_a28bc0": "#8ec9a0",
    "c_aad94c": "#a8e6a1",
    "c_acb6bf": "#6b8f71",
    "c_bfbdb6": "#bfbdb6",
    "c_c594c5": "#7ec699",
    "c_c7c7c7": "#c7c7c7",
    "c_cda1fa": "#a8e6a1",
    "c_d2a6ff": "#c9e894",
    "c_d95757": "#d95757",
    "c_e06c75": "#6ec985",
    "c_e1af4b": "#52b068",
    "c_e6b450": "#5dbd73",
    "c_e6b673": "#a8e6a1",
    "c_ea6c73": "#ea6c73",
    "c_f07178": "#8fd4a0",
    "c_f26d78": "#e07070",
    "c_f29668": "#7ec699",
    "c_f7ecb5": "#c9e894",
    "c_f9af4f": "#c9e894",
    "c_ff8f40": "#6ec985",
    "c_ffb454": "#a8e6a1",
    "c_ffffff": "#ffffff"
  }
}
