{
  "id": "obsidian",
  "label": "Carbon Rewind Color Theme - Obsidian",
  "scaffold": "maya",
  "roles": {
    "c_000000": "#000000",
    "c_0b0e14": "#101418",
    "c_0d1017": "#141920",
    "c_0f131a": "#12161c",
    "c_11151c": "#1a2028",
    "c_131721": "#161b22",
    "c_39bae6": "#8fd4c8",
    "c_409fff": "#56c2c24d",
    "c_475266": "#3a4550",
    "c_53bdfa": "#56c2c2",
    "c_565b66": "#8899aa",
    "c_59c2ff": "#56c2c2",
    "c_5f4c72": "#3a5050",
    "c_686868": "#686868",
    "c_6c5980": "#4a6060",
    "c_6c7380": "#708090",
    "c_73b8ff": "#56c2c2",
    "c_7fd962": "#7fd962",
    "c_90e1c6": "#8fd4c8",
    "c_95e6cb": "#8fd4c8",
    "c_a28bc0": "#a0b8c0",
    "c_aad94c": "#8fd4c8",
    "c_acb6bf": "#708090",
    "c_bfbdb6": "#b0bec5",
    "c_c594c5": "#8fd4c8",
    "c_c7c7c7": "#c7c7c7",
    "c_cda1fa": "#a0c8c0",
    "c_d2a6ff": "#d4a843",
    "c_d95757": "#d95757",
    "c_e06c75": "#8fd4c8",
    "c_e1af4b": "#4db8b8",
    "c_e6b450": "#56c2c2",
    "c_e6b673": "#d4a843",
    "c_ea6c73": "#ea6c73",
    "c_f07178": "#a0c8c0",
    "c_f26d78": "#e07070",
    "c_f29668": "#8fd4c8",
    "c_f7ecb5": "#d4a843",
    "c_f9af4f": "#d4a843",
    "c_ff8f40": "#6ec9c9",
    "c_ffb454": "#d4a843",
    "c_ffffff": "#ffffff"
  }
}
