{
  "id": "winter",
  "label": "Carbon Rewind Color Theme - Winter",
  "scaffold": "winter",
  "roles": {
    "c_000000": "#000000",
    "c_000a11": "#000a11",
    "c_001111": "#001111",
    "c_00bff9": "#00bff9",
    "c_010e1a": "#010e1a",
    "c_011627": "#011627",
    "c_022846": "#022846",
    "c_03648a": "#03648a",
    "c_060d1f": "#060d1f",
    "c_071021": "#071021",
    "c_084d81": "#084d81",
    "c_0b253a": "#0b253a",
    "c_0b2942": "#0b2942",
    "c_0c4994": "#0c4994",
    "c_0e293f": "#0e293f",
    "c_0e2c45": "#0e2c45",
    "c_103362": "#103362",
    "c_112233": "#112233",
    "c_122d42": "#122d42",
    "c_151d25": "#151d25",
    "c_181a1f": "#181a1f",
    "c_219fd5": "#219fd5",
    "c_262a39": "#262a39",
    "c_2b2f40": "#2b2f40",
    "c_2c3043": "#2c3043",
    "c_2e3250": "#2e3250",
    "c_303030": "#303030",
    "c_3b3a32": "#3b3a32",
    "c_4373c2": "#4373c2",
    "c_4fb4d8": "#4fb4d8",
    "c_57cdff": "#57cdff",
    "c_5abeb0": "#5abeb0",
    "c_5f7e97": "#5f7e97",
    "c_697098": "#697098",
    "c_6bff81": "#6bff81",
    "c_6dbdfa": "#6dbdfa",
    "c_7799bb": "#7799bb",
    "c_78bd65": "#78bd65",
    "c_7e57c2": "#7e57c2",
    "c_7fdbca": "#7fdbca",
    "c_80cbc4": "#80cbc4",
    "c_82aaff": "#82aaff",
    "c_87aff4": "#87aff4",
    "c_8dec95": "#8dec95",
    "c_91dacd": "#91dacd",
    "c_92b6f4": "#92b6f4",
    "c_975f94": "#975f94",
    "c_98c8ed": "#98c8ed",
    "c_999999": "#999999",
    "c_99b76d": "#99b76d",
    "c_99d0f7": "#99d0f7",
    "c_a170c6": "#a170c6",
    "c_a1bde6": "#a1bde6",
    "c_a4ceee": "#a4ceee",
    "c_a7dbf7": "#a7dbf7",
    "c_addb67": "#addb67",
    "c_b15a91": "#b15a91",
    "c_bce7ff": "#bce7ff",
    "c_bcf0c0": "#bcf0c0",
    "c_c63ed3": "#c63ed3",
    "c_c792ea": "#c792ea",
    "c_cbcdd2": "#cbcdd2",
    "c_cecece": "#cecece",
    "c_d29ffc": "#d29ffc",
    "c_d2dee7": "#d2dee7",
    "c_d3eed6": "#d3eed6",
    "c_d6deeb": "#d6deeb",
    "c_d7dbe0": "#d7dbe0",
    "c_e0aff5": "#e0aff5",
    "c_ec9cd2": "#ec9cd2",
    "c_ece7cd": "#ece7cd",
    "c_eeefff": "#eeefff",
    "c_eeffff": "#eeffff",
    "c_ef5350": "#ef5350",
    "c_f29fd8": "#f29fd8",
    "c_f3b8c2": "#f3b8c2",
    "c_f7ecb5": "#f7ecb5",
    "c_ffca28": "#ffca28",
    "c_ffffff": "#ffffff"
  }
}
