{
  "id": "pure",
  "label": "Carbon Rewind Color Theme - Pure",
  "scaffold": "pure",
  "roles": {
    "c_000000": "#000000",
    "c_07d258": "#07d258",
    "c_0b0c0e": "#0b0c0e",
    "c_121212": "#121212",
    "c_141519": "#141519",
    "c_1b1d22": "#1b1d22",
    "c_20bcff": "#20bcff",
    "c_24966e": "#24966e",
    "c_282c33": "#282c33",
    "c_2f7ecd": "#2f7ecd",
    "c_3398db": "#3398db",
    "c_370067": "#370067",
    "c_37ae6f": "#37ae6f",
    "c_4c5767": "#4c5767",
    "c_56b6c2": "#56b6c2",
    "c_5c6370": "#5c6370",
    "c_61afef": "#61afef",
    "c_627e99": "#627e99",
    "c_6796e6": "#6796e6",
    "c_696969": "#696969",
    "c_75715e": "#75715e",
    "c_8b56bf": "#8b56bf",
    "c_98c379": "#98c379",
    "c_9aa1ac": "#9aa1ac",
    "c_abb2bf": "#abb2bf",
    "c_b267e6": "#b267e6",
    "c_bbbbbb": "#bbbbbb",
    "c_bd1c98": "#bd1c98",
    "c_bf568b": "#bf568b",
    "c_bf8b56": "#bf8b56",
    "c_bfa656": "#bfa656",
    "c_c13838": "#c13838",
    "c_c678dd": "#c678dd",
    "c_cbd6e2": "#cbd6e2",
    "c_cd9731": "#cd9731",
    "c_d19a66": "#d19a66",
    "c_d26d32": "#d26d32",
    "c_d39e17": "#d39e17",
    "c_e06c75": "#e06c75",
    "c_e3b625": "#e3b625",
    "c_e5c07b": "#e5c07b",
    "c_e6d7f4": "#e6d7f4",
    "c_f44747": "#f44747",
    "c_f8f8f0": "#f8f8f0",
    "c_ffffff": "#ffffff"
  }
}
