{
  "id": "ember",
  "label": "Carbon Rewind Color Theme - Ember",
  "scaffold": "maya",
  "roles": {
    "c_000000": "#000000",
    "c_0b0e14": "#110c0a",
    "c_0d1017": "#1a1210",
    "c_0f131a": "#160f0d",
    "c_11151c": "#241815",
    "c_131721": "#1a1210",
    "c_39bae6": "#f2b8c6",
    "c_409fff": "#e8654a",
    "c_475266": "#475266",
    "c_53bdfa": "#ff9a80",
    "c_565b66": "#7a6058",
    "c_59c2ff": "#ffb4a0",
    "c_5f4c72": "#5f4c72",
    "c_686868": "#686868",
    "c_6c5980": "#6c5980",
    "c_6c7380": "#8a7068",
    "c_73b8ff": "#ff9a80",
    "c_7fd962": "#c9e894",
    "c_90e1c6": "#f0c8a8",
    "c_95e6cb": "#f0c8a8",
    "c_a28bc0": "#d4a090",
    "c_aad94c": "#f0a878",
    "c_acb6bf": "#8a6a60",
    "c_bfbdb6": "#bfbdb6",
    "c_c594c5": "#c98878",
    "c_c7c7c7": "#c7c7c7",
    "c_cda1fa": "#f2b8c6",
    "c_d2a6ff": "#f2b8c6",
    "c_d95757": "#e85545",
    "c_e06c75": "#ff7e6b",
    "c_e1af4b": "#d85a3f",
    "c_e6b450": "#e8654a",
    "c_e6b673": "#e0a878",
    "c_ea6c73": "#e85545",
    "c_f07178": "#ff8a7a",
    "c_f26d78": "#e85545",
    "c_f29668": "#e07a55",
    "c_f7ecb5": "#f0d0b0",
    "c_f9af4f": "#f0a878",
    "c_ff8f40": "#ff7e6b",
    "c_ffb454": "#f0a878",
    "c_ffffff": "#ffffff"
  }
}
