{
  "id": "aurora",
  "label": "Carbon Rewind Color Theme - Aurora",
  "scaffold": "maya",
  "roles": {
    "c_000000": "#000000",
    "c_0b0e14": "#050810",
    "c_0d1017": "#0a1018",
    "c_0f131a": "#080c14",
    "c_11151c": "#101828",
    "c_131721": "#0c1018",
    "c_39bae6": "#7dd3fc",
    "c_409fff": "#6ee7b74d",
    "c_475266": "#203040",
    "c_53bdfa": "#6ee7b7",
    "c_565b66": "#506878",
    "c_59c2ff": "#6ee7b7",
    "c_5f4c72": "#304060",
    "c_686868": "#686868",
    "c_6c5980": "#405080",
    "c_6c7380": "#6080a0",
    "c_73b8ff": "#7dd3fc",
    "c_7fd962": "#6ee7b7",
    "c_90e1c6": "#9af0c3",
    "c_95e6cb": "#9af0c3",
    "c_a28bc0": "#c084fc",
    "c_aad94c": "#9af0c3",
    "c_acb6bf": "#6080a0",
    "c_bfbdb6": "#bfbdb6",
    "c_c594c5": "#9af0c3",
    "c_c7c7c7": "#c7c7c7",
    "c_cda1fa": "#d8a4ff",
    "c_d2a6ff": "#d8a4ff",
    "c_d95757": "#d95757",
    "c_e06c75": "#d8a4ff",
    "c_e1af4b": "#5fd9a8",
    "c_e6b450": "#6ee7b7",
    "c_e6b673": "#c084fc",
    "c_ea6c73": "#ea6c73",
    "c_f07178": "#d8a4ff",
    "c_f26d78": "#f26d78",
    "c_f29668": "#d8a4ff",
    "c_f7ecb5": "#7dd3fc",
    "c_f9af4f": "#7dd3fc",
    "c_ff8f40": "#c084fc",
    "c_ffb454": "#7dd3fc",
    "c_ffffff": "#ffffff"
  }
}
